title,artist,year,source,lyrics
Big Energy,Latto,2022,human,"I got that big, big energy
Got that real big energy
Hey, daddy
When you gon' stop playin'?
Bad bitch, I could be your fantasy (Yeah)

I can tell you got big dick energy (Uh-huh)

It ain't too niggas that can handle me (Yeah)

But I might let you try it off the Hennessy (Uh)

Make 'em sing to this pussy like a melody (Make 'em sang)

And if your bitch ain't right, I got the remedy (Ooh)

It ain't too niggas that can handle me (Ayy)

Bad bitch, I could be your fantasy (Ayy, ayy)



Tell me how you want it (Huh?)

Three, two, one and I'm on it (On it)

Feel good, don't it? (Don't it?)

Hood bitch, fuck you bonnet (Yeah)

I'ma bust it down the pole like onyx (Ooh)

Want you bein' honest (Uh-huh)

Pussy juicy, Minute Maid (Oh)

But can't do it onе minute, man (Hell no)

Not a side hoе, a main

I'm the only bitch he entertain (Yeah)

Spendin' his mind in the bank (In the bank)

I like what I see (Yeah)

A boss like you need a boss like me (Uh-huh)

Daddy from the street, so he move lowkey

Tryna ride that mic' like karaoke (Oh)



On the count of three, bad bitches, get money (Money)

Broke niggas to the left, we don't want it (We don't want)

I'm the one these bitches hate but they can't get past (Uh-huh)

Pretty face, no waist and a big ol' ass, ha



Bad bitch, I could be your fantasy (Yeah)

I can tell you got big dick energy (Uh-huh)

It ain't too niggas that can handle me (Yeah)

But I might let you try it off the Hennessy (Uh)

Make 'em sing to this pussy like a melody (Make 'em sang)

And if your bitch ain't right, I got the remedy (Ooh)

It ain't too niggas that can handle me (Ayy)

Bad bitch, I could be your fantasy (Ayy, ayy)



You got that real big energy

You got that big dick energy (Big dick energy)

You got that real big energy

You got that big dick energy (Big dick energy)



Yuh, tell me how you want it? (Want it)

Three, two, one, camera rollin' (Ooh)

Do it slow motion (Uh-huh)

Real bitch, them other hoes phony

All that big talk, Latto put 'em on it (Latto)

I'm just bein' honest (Yeah)

Lingerie Dolce (Ha)

Blindfold (Yeah), tie me to the bed (Yeah), while we roleplay (Yeah)

Can't skip foreplay, kill the pussy cold case (Uh-huh)

I'm a boss bitch but tonight we do it your way



On the count of three, bad bitches, get money (Get money)

Broke niggas to the left, we don't want it (Hell nah)

If you ever see me work, I'm probably rockin' a case

Pretty face, no waist with a big ol' bag, ha



Bad bitch, I could be your fantasy (Yeah)

I can tell you got big dick energy (Uh-huh)

It ain't too niggas that can handle me (Yeah)

But I might let you try it off the Hennessy (Uh)

Make 'em sing to this pussy like a melody (Make 'em sang)

And if your bitch ain't right, I got the remedy (Ooh)

It ain't too niggas that can handle me (Ayy)

Bad bitch, I could be your fantasy (Ayy, ayy)



You got that real big energy (Uh-huh)

You got that big dick energy (Big dick energy, yeah)

You got that real big energy (Oh)

You got that big dick energy (Big dick energy, ayy)"
Ghost,Justin Bieber,2022,human,"Youngblood thinks there's always tomorrow
I miss your touch some nights when I'm hollow
I know your cross the bridge I can't follow
Since the love that you left is all that I get
I want you to know that



If I can't be close to you

I'll settle for the ghost of you

I miss you more than life

And if you can't be next to me

Your memory is ecstasy

I miss you more than life

I miss you more than life



Youngblood thinks there's always tomorrow

I need more time, but time can't be borrowed

I'd leave it all behind if I could follow



Since the love that you left is all that I get

I want you to know that



If I can't be close to you

I'll settle for the ghost of you

I miss you more than life

And if you can't be next to me

Your memory is ecstasy

I miss you more than life

I miss you more than life

I miss you more than life

If I can't be close to you

I'll settle for the ghost of you

I miss you more than life

And if you can't be next to me

Your memory is ecstasy

I miss you more than life

I miss you more than life"
Super Gremlin,Kodak Black,2022,human,"Yeah, we could be superstars
We been rather wreckin' cars (Ayy bro, is that Jambo?)
What is at stake for us?
Kickin' off power mirrors
Yeah, we could be superstars
But I'm pretty sure our time is up

And so we fell off the spinning tops

Don't know, maybe for trial

But way more error (ATL Jacob, ATL Jacob)



Say you my nigga, I'ma be your killer

Nobody gon' play with you when I'm with you

Go against any nigga, like, fuck this glitter

Skeet off third, I'm busy

I put it in for you, I spin for you

Whatever you with, I'm with it

How you gon' cross a nigga that was rockin' with you? I got you lit in the city

I been multitaskin', rappin' and bein' a daddy to my lil' children

I been standin' on business, and spinnin' and spinnin' and spinnin' until I'm dizzy

I do all the smackin', you ain't never stepped or helped with none of this killin'

You doin' a lot of cappin', watch when I catch you, I'ma whack you in front of thе witness



Damn, my nigga, you trippin'

We could've been supеrstars

Remember when we was jackin' cars

Now, it's not safe for you

You switched like a pussy, lil' bitch

Damn, my nigga, you trippin'

We could've been superstars

Can't help it, now I'm reminiscing

Remember when we was jackin' cars

Now, you better keep your distance

'Cause it's not safe for you

You switched like a pussy, lil' bitch



Trackhawk with the kit, snatch off on the bitch when I slide

Nightlight on the blick, bet I'm on my shit when I'm outside

Zoe done ran down, caught him pants down, nigga, you shitted

I knew the Perc' was fake, but I still ate it 'cause I'm a gremlin



Yeah, Kutthroat Businezz, KTB, backdoor wide open

Wait 'til my sniper get out, all you niggas gon' die, time rollin'

Bustin' on my opponent, no half-steppin', crushin' my opps totally

We was just broke with no motion

Sleepin' on sofas, creepin' in houses like roaches

I done went cages, to stages, to cages

Now free me, baby, can't keep me, baby

I beat them cases, they already hate me

They gon' want me dead when I'm on probation

Oh, y'all think lil' Yak retarded?

Y'all ain't seen none yet, I promise

Niggas can't take me, niggas can't guard me

I be on a fuck nigga ass like Charmin

AK, twenty-inch carbon



We could've been superstars

Remember when we was jackin' cars

Now, it's not safe for you

You switched like a pussy, lil' bitch

Damn, my nigga, you trippin'

We could've been superstars

Can't help it, now I'm reminiscing

Remember when we was jackin' cars

Now, you better keep your distance

'Cause it's not safe for you

You switched like a pussy, lil' bitch



Trackhawk with the kit, snatch off on the bitch when I slide

Nightlight on the blick, bet I'm on my shit when I'm outside

Zoe done ran down, caught him pants down, nigga, you shitted

I knew the Perc' was fake, but I still ate it 'cause I'm a gremlin



Yeah, we could be superstars (Super Gremlin)

But I'm pretty sure our time is up (Now your time is up)

And so we fell off the spinning tops

Don't know, maybe for trial, but way more error

I ain't slimy, I'm grimy

Any way you put it, I'm SG with it, I'm Super Gremlin

Snatch and grab, sneak and geek, Sniper Gang, trust

Nightmare, baby, you know I-

I bet you always see me in your dreams

Glee"
Cold Heart (Pnau Remix),Elton John and Dua Lipa,2022,human,"(Oh)
(You're my cold heart)
(Oh)
It's a human sign
When things go wrong

When the scent of her lingers

And temptation's strong



Cold, cold heart

Hardened by you (Oh)

Some things lookin' better, baby

Just passin' through (No, no, no, no, no)



And I think it's gonna be a long, long time

'Til touchdown brings me 'round again to find

I'm not the man they think I am at home

Oh no, no, no

And this is what I should have said

Well, I thought it, but I kept it hid



Cold, cold heart

Hardened by you (Oh)

Some things lookin' better, baby

Just passin' through (No, no, no, no, no)



And I think it's gonna be a long, long time

'Til touchdown brings me 'round again to find

I'm not the man they think I am at home

Oh no, no, no (No, no, no, no, no)

And this is what I should have said

Well, I thought it, but I kept it hid



Cold, cold heart (Oh)

Hardened by you

Some things lookin' better, baby (Oh)

Just passin' through (No, no, no, no, no)



And I think it's gonna be a long, long time

'Til touchdown brings me 'round again to find

I'm not the man they think I am at home

Oh no, no, no (No, no, no, no, no)

And this is what I should have said (And I think it's gonna be a long, long time)

('Til touchdown brings me 'round again to find)

Well, I thought it, but I kept it hid (I'm not the man they think I am at home)

(Oh, no, no, no)

(No, no, no, no, no)



Shoorah (Oh)

Shoorah

Shoorah (Oh)

Shoorah

(No, no, no, no, no)"
Wait for U,Future featuring Drake and Tems,2022,human,"I will wait for you, for you
Early in the mornin', late at night (I will wait for you)
It doesn't even matter what time it is (I will wait for you)
Presidential Rollie already on the way (Tired, sayin', ""Aye, yi, yi, yi"")
Whenever I find time, it's okay (Ayy)
ATL Jacob, ATL Jacob



You pray for my demons, girl, I got you

Every time I sip on codeine, I get vulnerable

I'm knowin' the sounds of the storm when it come

She understand I can't take her everywhere a nigga going

I been in the field like the childrеn of the corn



I can hear your tears whеn they drop over the phone

Get mad at yourself 'cause you can't leave me alone

Gossip, bein' messy, that ain't what we doing (Worried 'bout a Xanny)

Travel around the world (Would you brag, or would you try to get me?)

Over the phone, dropping tears (Tell me now, I know that you be braggin')

I get more vulnerable when I do pills (Tell me now, I need you so bad, yeah)

When you drunk, you tell me exactly how you feel (I will wait for you, for you)

When I'm loaded, I keep it real (I will wait for you, I will wait for you)

Please tell a real one exactly what it is (I will wait, will wait, for you, for you)

Don't say it 'cause you know that's what I wanna hear (I will wait for you, I will wait for you)



Yeah, I been trappin' 'round the world

I sit on my balcony and wonder how you feelin'

I got a career that takes my time away from women

I cannot convince you that I love you for a livin' (Will wait for you, for you)

I be on your line, feelings flowin' like a river

You be textin' back you at Kiki on the river (I will wait for you)

Message say delivered (I will wait for you), but I know that you don't get it

Why you introduce us if you knew that you was with him? (I will wait for you, for you, for you)

Made me shake his hand when y'all been fuckin' for a minute (I will wait for you, for you)

Walk me off the plank because you know that I'm a swimmer (I will wait for you)

Supposed to be your dog, but you done put me in a kennel

Girl, put a muzzle on it, all that barkin' over dinner

I was fuckin' with you when you had the tiny Presidential

You got better when you met me and that ain't coincidental

Tried to bring the best out you but, guess I'm not that influential

Guess I'm not the one that's meant for you



I can hear your tears when they drop over the phone

Get mad at myself 'cause I can't leave You alone

Gossip, bein' messy, that ain't what we doing, yeah (Worried 'bout a Xanny)

Trappin' around the world (Would you brag, or would you try to get me?)

Over the phone, dropping tears (Tell me now, I know that you be braggin')

I get more vulnerable when I do pills (Tell me now, I need you too bad, yeah)

When you drunk, you tell me exactly how you feel (I will wait for you, for you)

When I'm loaded, I keep it real (I will wait for you, I will wait for you)

Please tell a real one exactly what it is (I will wait, will wait, for you, for you)

Don't say it 'cause you know that's what I wanna hear (I will wait for you)



Early in the mornin', late at night

It don't even matter what time it is

Worried 'bout a Xanny, would you brag, or would you try to get me?

Tell me now, I know that you be braggin'

Tell me now"
About Damn Time,Lizzo,2022,human,"Anyway
It's bad bitch o'clock, yeah, it's thick-thirty
I've been through a lot, but I'm still flirty (Okay)
Is everybody back up in the buildin'?
It's been a minute, tell me how you're healin'

'Cause I'm about to get into my feelings

How you feelin'? How you feel right now?



Oh, I been so down and under pressure

I'm way too fine to be this stressed, yeah

Oh, I'm not the girl I was or used to be, uh

Bitch, I might be better



Turn up the music, turn down the lights

I got a feelin' I'm gon' be alright

Okay (Okay), alright

It's about damn time (Time)

Turn up the music, let's celebrate (Alright)

I got a feelin' I'm gon' be okay

Okay (Okay), alright

It's about damn time



In a minute, I'ma need a sentimental

Man or woman to pump me up

Feelin' fussy, walkin' in my Balenci-ussies

Tryna bring out the fabulous

'Cause I give a fuck way too much

I'ma need like two shots in my cup

Wanna get up, wanna get down

Mm, that's how I feel right now



Oh, I been so down and under pressure

I'm way too fine to be this stressed, yeah

Oh, I'm not the girl I was or used to be, uh

Bitch, I might be better



Turn up the music, turn down the lights

I got a feelin' I'm gon' be alright

Okay (Okay), alright

It's about damn time (Time)

Turn up the music, let's celebrate (Alright)

I got a feelin' I'm gon' be okay

Okay (Okay), alright

It's about damn time



Bitch

'Cause, uh, you know what time it is, uh

I'm comin' out tonight, I'm comin' out tonight (Uh-huh)

I'm comin' out tonight, I'm comin' out tonight (Woo)

I'm comin' out tonight, I'm comin' out tonight

Okay (Okay), alright (Alright)

It's about damn time

I'm comin' out tonight (Let's go), I'm comin' out tonight (Comin' out tonight)

I'm comin' out tonight, I'm comin' out tonight (Woo)

I'm comin' out tonight, I'm comin' out tonight (Comin' out tonight)

Okay (Okay), alright

It's about damn time (Oh)



Bitch

Yeah, yeah

It's about damn time"
Bad Habits,Ed Sheeran,2022,human,"(One, two, three, four)
Ooh, ooh
Every time you come around, you know I can't say no
Every time the sun goes down, I let you take control
I can feel the paradise before my world implodes

And tonight I had something wonderful



My bad habits lead to late nights, endin' alone

Conversations with a stranger I barely know

Swearin' this will be the last but it probably won't

I got nothin' left to lose, or use, or do

My bad habits lead to wide eyes stare into space

And I know I'll lose control of the things that I say

Yeah, I was lookin' for a way out, now I can't escape

Nothin' happens aftеr two, it's true, it's true

My bad habits lead to you



Ooh-ooh, ooh-ooh

My bad habits lеad to you

Ooh-ooh, ooh-ooh

My bad habits lead to you



Every pure intention ends when the good times start

Fallin' over everything to reach the first time's spark

It started under neon lights and then it all got dark

I only know how to go too far



My bad habits lead to late nights, endin' alone

Conversations with a stranger I barely know

Swearin' this will be the last but it probably won't

I got nothin' left to lose, or use, or do

My bad habits lead to wide eyes stare into space

And I know I'll lose control of the things that I say

Yeah, I was lookin' for a way out, now I can't escape

Nothin' happens after two, it's true, it's true

My bad habits lead to you



Ooh-ooh, ooh-ooh

My bad habits lead to you

Ooh-ooh, ooh-ooh

My bad habits lead to you



We took the long way 'round

And burned 'til the fun ran out, now



My bad habits lead to late nights, endin' alone

Conversations with a stranger I barely know

Swearin' this will be the last but it probably won't

I got nothin' left to lose, or use, or do

My bad habits lead to wide eyes stare into space

And I know I'll lose control of the things that I say

Yeah, I was lookin' for a way out, now I can't escape

Nothin' happens after two, it's true, it's true

My bad habits lead to you



Ooh-ooh, ooh-ooh

My bad habits lead to you

Ooh-ooh, ooh-ooh

My bad habits lead to you"
Thats What I Want,Lil Nas X,2022,human,"1, 2, 3, 4
Need a boy who can cuddle with me all night
Keep me warm, love me long, be my sunlight
Tell me lies, we can argue, we can fight
Yeah, we did it before, but we'll do it tonight

An afro, black boy with the gold teeth

Dark skin, lookin' at me like he know me

I wonder if he got the G or the B

Let me find out and see, comin' over to me, yeah



These days I'm way too lonely

I'm missin' out, I know

These days I'm way too alone

And I'm known for giving love away but



I want someone to love me

I need somеone who needs me

'Cause it don't feel right whеn it's late at night

And it's just me in my dreams

So I want someone to love

That's what I fuckin' want



Look, you know it's harder to find in these times

But I got nothin' but love on my mind (My mind)

I need a baby with love in my prime

Need an adversary to my down to marry

Like, tell me that's life when I'm stressin' at night

Be like ""You'll be okay"" and ""Everything's all right""

Let me up in there 'cause I'm not wantin' anything

But you're lovin' your body and a little bit of your brain



These days I'm way too lonely

I'm missin' out, I know

These days I'm way too alone

And I'm known for giving love away but



I want someone to love me

I need someone who needs me

'Cause it don't feel right when it's late at night

And it's just me in my dreams

So I want someone to love

That's what I fuckin' want

I want someone to love me

I need someone who needs me

'Cause it don't feel right when it's late at night

And it's just me in my dreams

So I want someone to love

That's what I fuckin' want"
Enemy,Imagine Dragons and JID,2022,human,"Look out for yourself
I wake up to the sounds of the silence that allows
For my mind to run around, with my ear up to the ground
I’m searching to behold the stories that are told
When my back is to the world that was smiling when I turned



Tell you you’re the greatest

But once you turn, they hate us



Oh, the misery

Everybody wants to be my enemy

Spare the sympathy

Everybody wants to be my enemy-y-y-y-y

(Look out for yourself)

My enemy-y-y-y-y

(Look out for yourself)

But I’m ready



Your words up on thе wall as you’rе prayin’ for my fall

And the laughter in thе halls and the namеs that I’ve been called

I stack it in my mind, and I’m waiting for the time

When I show you what it’s like to be words spit in a mic



Tell you you’re the greatest

But once you turn, they hate us (Huh)



Oh, the misery

Everybody wants to be my enemy

Spare the sympathy

Everybody wants to be my enemy-y-y-y-y

(Look out for yourself)

My enemy-y-y-y-y (Yeah)

(Look out for yourself)

Uh, look, okay



I’m hoping that somebody pray for me

I’m praying that somebody hope for me

I’m staying where nobody ‘posed to be p-p-posted

Being a wreck of emotions

Ready to go whenever just let me know

The road is long, so put the pedal into the floor

The enemy’s on my trail, my energy unavailable

I’ma tell ’em, “Hasta luego”

They wanna plot on my trot to the top

I’ve been outta shape, thinkin’ out the box

I’m an astronaut

I blasted off the planet rock to cause catastrophe

And it matters more because I had it not

Had I thought about wreaking havoc

On an opposition, kinda shockin’

They wanted static with precision

I’m automatic quarterback

I ain’t talkin’ sacking, pack it

Pack it up, I don’t panic, batter-batter up

Who the baddest?

It don’t matter ’cause we at ya throat



Everybody wants to be my enemy

Spare the sympathy

Everybody wants to be my enemy

Oh, the misery

Everybody wants to be my enemy

Spare the sympathy

Everybody wants to be my enemy



Ayo-ay, I swear I never be insane-oh-ay

My enemy

Ayo-ay, I swear I never be insane

(Look out for yourself)"
Industry Baby,Lil Nas X and Jack Harlow,2022,human,"D-D-Daytrip took it to ten (Hey)
Baby bet, ayy, couple racks, ayy
Couple Grammys on him (Ah, ooh), couple plaques, ayy
That's a fact, ayy (Ah, ooh), throw it back, ayy
Throw it back, ayy (Ah, ooh)



And this one is for the champions (Ah, ooh)

I ain't lost since I've began, yeah (Ah, ooh)

Funny how you said it was the end, yeah (Ah, ooh)

Then I went, did it again, yeah (Ah, ooh)



I told you long ago on the road

I got what they're waiting for

I'll run from nothing, dawg, get your swords

Just tell 'em I ain't layin' low

You was never really rooting for me anyway (Ah, ooh)

When I'm back up at the top I wanna hear you say (Ah, ooh)

He'll run from nothin', dawg, get your sword (Ah, ooh)

Just tell 'em that the break is over (Ah, ooh, ah, ooh, ah, ooh)



Need, uh, need to get this album out

Need a couple number onеs

Need a plaque on every song

Need mе like one with Nicki now

Tell a rap nigga I don't see ya, huh

I'm a pop nigga like Bieber, huh

I don't fuck bitches, I'm queer, huh

But these niggas bitches like Madea, yeah, yeah, yeah (Yeah)

Ayy, oh, let's do it (Oh, let's do it)

I ain't fall off, I just ain't release my new shit

I blew up, now everybody tryna sue me

You call me Nas but the hood call me Doobie, dawg



And this one is for the champions (Ah, ooh)

I ain't lost since I've began, yeah (Ah, ooh)

Funny how you said it was the end, yeah (Ah, ooh)

Then I went did it again, yeah (Ah, ooh, again, yeah)



I told you long ago on the road

I got what they're waiting for

(Ayy, ayy, ayy, ayy, I got what they're waiting for)

I'll run from nothing, dawg, get your swords (Ayy, ayy)

Just tell 'em I ain't layin' low (Ayy, ayy)

(Bitch, I ain't runnin' from nowhere)

You was never really rooting for me anyway (Ah, ooh)

When I'm back up at the top I wanna hear you say (Ah, ooh)

He'll run from nothin', dawg, get your sword (Ayy)

Just tell 'em that the break is over (Ayy, yeah)



My track record so clean, they couldn't wait to just bash me

I must be gettin' too flashy, y'all shouldn't have let the world gas me (Woo)

It's too late 'cause I'm here to stay and these girls know that I'm nasty (Mm)

I sent her back to her boyfriend with my handprint on her ass cheek

City talkin', we takin' notes

Tell 'em all to keep makin' posts, wish he could, but he can't get close

OG so proud of me, that he chokin' up while he makin' toast

I'm the type that you can't control, said I would, then I made it so

I don't clear up rumors (Ayy), where's y'all sense of humor? (Ayy)

I'm done makin' jokes 'cause they got old like baby boomers

Turn my haters to consumers, I make vets feel like they juniors (Juniors)

Say your time is comin' soon but just like Oklahoma (Mmm)

Mine is comin' sooner (Mmm), I'm just a late bloomer (Mmm)

I done peaked in high school, I'm still out here gettin' cuter (Woo)

All these social networks and computers

Got these pussies walkin' 'round like they ain't losers



I told you long ago on the road

I got what they're waiting for

(Ayy, ayy, ayy, ayy, I got what they're waiting for)

I'll run from nothing, dawg, get your swords (Ayy, ayy)

Just tell 'em I ain't layin' low (Ayy, ayy)

(Bitch, I ain't runnin' from nowhere)

You was never really rooting for me anyway (Ah, ooh)

When I'm back up at the top I wanna hear you say (Ah, ooh)

He'll run from nothin', dawg, get your sword (Ayy)

Just tell 'em that the break is over (Ayy)



Yeah

I'm the industry baby

I'm the industry baby

Yeah"
ABCDEFU,Gayle,2022,human,"I swear I meant to mean the best when it ended
Even tried to bite my tongue when you start shit
Now you're textin' all my friends asking questions
They never even liked you in the first place
Dated a girl that I hate for the attention
She only made it two days, what a connection

It's like you'd do anything for my affection

You're goin' all about it in the worst ways



I was into you, but I'm over it now

And I was tryna be nice

But nothing's getting through, so let me spеll it out



A-B-C-D-E, fuck you

And your mom and your sister and your job

And your broke-ass car and that shit you call art

Fuck you and your friends that I'll nеver see again

Everybody but your dog, you can all fuck off



Nah-nah-nah, nah-nah, nah, nah-nah

A-B-C-D-E, fuck you



You said you just needed space and so I gave it

When I had nothin' to say you couldn't take it

Told everyone I'm a bitch, so I became it

Always had to put yourself above me



I was into you, but I'm over it now

And I was tryna be nice

But nothing's getting through, so let me spell it out



A-B-C-D-E, fuck you

And your mom and your sister and your job

And your craigslist couch and the way your voice sounds

Fuck you and your friends that I'll never see again

Everybody but your dog, you can all fuck off



Nah-nah-nah, nah-nah, nah, nah-nah

A-B-C-D-E, fuck off

Nah-nah-nah, nah-nah, nah, nah-nah

A-B-C-D-E, fuck you



And your mom and your sister and your job

And your broke-ass car and that shit you call art

Fuck you and your friends that I'll never see again

Everybody but your dog, you can all fuck off"
