title,artist,year,source,lyrics
Moscow Mule,Bad Bunny,2022,human,"Si yo no te escribo, tú no me escribe', ey
Si tú quieres, te busco, yo sé dónde tú vive'
Quizá hoy está aborrecía'
Pero por dentro tú tiene' alegría
Si quieres te la saco

Dos trago' y sabes que me pongo bellaco

No somo' na', pero estamo' envuelto' hace rato, oh-oh

WhatsApp sin el retrato, no guarda mi contacto (Ey, ey, ey, ey)

Pero se la saco

Dos trago' y sabes que me pongo bellaco

No somo' na', pero estamo' envuelto' hace rato, oh-oh

WhatsApp sin el retrato, no guarda mi contacto-to



Todo e' underwater (Ey)

Baby, vamo' pa'l cuarto quarter

En la Uru' comiéndono' el pate

Te vo'a dar duro pa' que no me compare'

Ey, cuida'o con ese mahón, que se va a romper (Ey)

Ese booty lo va a romper (Ey)

Yo no sé si yo te vuelvo a ver

Si mañana me vo'a perder

Tú ere' una player, me hiciste un crossover

Esta ve' metiste, me diste game over, eh-eh (Huh)

Porque no puedo olvidar

El perreo aquel, que se fue viral

Dime si mañana te va' a quedar

Después de la alarma te lo voy a dar

Ey, hoy tú no va' a trabajar, jeje, no



Si quieres te la saco

Dos trago' y sabes que me pongo bellaco

No somo' na', pero estamo' envuelto' hace rato, oh-oh

WhatsApp sin el retrato, no guarda mi contacto

Pero se la saco

Dos trago' y sabes que me pongo bellaco

No somo' na', pero estamo' envuelto' hace rato, oh-oh

WhatsApp sin el retrato, no guarda mi contacto



Me gustan así, piquetúa

Mami, qué rica te ve' esnúa'

Quizás no sentiste lo que yo sentí

Pero aún te debo una noche en la suite

Pa' darte tabla, dale, mami, habla

Tú ere' una diablona, no te haga'

Pa' darte tabla, dale, mami, habla

Tú ere' una diablona, no te haga'



No, no, no, no (No, no, no, no)

No, no, no, no (No, no, no, no)

No, no, no, no (No, no, no, no)

Ey, yo no sé tú, pero yo quisiera amanecer esnú'

En una playa por Balí, si no, Cancún

Pide otro moscow mule (Ey)



Que ando en nota, nota

Ven y choca

Conmigo que se joda

Baby, tú 'tás grandota

Pero hoy ando en nota, nota

Ven y choca

Conmigo que se joda, eh

Que se joda, ey



Mami, tú quieres perreo (Tú quieres perreo)

Tú quieres perreo (Tú quieres perreo)

Tú quieres bellaqueo (Tú quieres bellaqueo)

Tú quieres bellaqueo (Tú quieres bellaqueo)

Mami, tú quieres perreo (Tú quieres perreo)

Tú quieres perreo (Tú quieres perreo)

Tú quieres bellaqueo (Tú quieres bellaqueo)

Tú quieres bellaqueo (Tú quieres bellaqueo)"
You Right,Doja Cat and the Weeknd,2022,human,"I got a man but, I want you
I got a man but, I want you
And it's just nerves, it's just dick
Making me think 'bout someone new
You know I got so much to say
I try to hide it in my face

And it don't work, you see through

That I just want to get with you



And you're right

You right, I got my guy

But I, I can't help it, I want you

Said, you right, I got my guy

But I, I can't help it, I want you



I can't stop and look the other way

'Cause I know it could be, babe, and you never feel the same

You'd be thinkin' 'bout it every day

Don't believe in fairytales, but we got our fantasies

And it's me and you, no she

Tryna be all through your sheets

Have you all on top of me

Actin' like it's not that deep

Boy, you can take it off of me

Tell me what it's 'bout to be

Really feel it's bound to bе

I can't tell no one, but they all know



I got a man but, I want you

I got a man but, I want you

And it's just nеrves, it's just dick

Making me think 'bout someone new

You know I got so much to say

I try to hide it in my face

And it don't work, you see through

That I just want to get with you



And you're right

You right, I got my guy

But I, I can't help it, I want you

Said, you right, I got my guy

But I, I can't help it, I want you



Girl, I want you like you want me too

I feel that energy (Oh, yeah) when you're on top of me (Oh, yeah)

I know your man, he ain't controllin' you

But you still hesitate (Oh) 'cause you choose loyalty (Oh, yeah)

And I know your history (Hey), met him before your peak (Hey)

He's so connected to that woman that you used to be

But-but-but the sex what clogged your memory

A couple strokes, I'll put it in, then you'll belong to me



I got a man but, I want you

I got a man but, I want you (Yeah)

And it's just nerves, it's just dick

Making me think 'bout someone new

You know I got so much to say

I try to hide it in my face

And it don't work, you see through

That I just want to get with you (Yeah, yeah, yeah, yeah)



And you're right (Right)

You right, I got my guy (I got my—)

But I, I can't help it, I want you

Said, you right (Yeah), I got my guy (Yeah)

But I (Yeah), I can't help it, I want you"
She Had Me at Heads Carolina,Cole Swindell,2022,human,"(Heads Carolina, tails California)
I was out with the boys, catchin' up in a neon light
Didn't know 'til we walked in it was karaoke night
She was in a circle of girls, chasin' a shot with a lime
She was laughin', they were darin' her to get on the mic

One of 'em walked up and turned in her name

Next thing I knew, man, she was up on the stage, singin'



""Heads Carolina, tails California""

Maybe she'd fall for a boy from South Georgia

She's got the bar in the palm of her hand

And she's a '90s country fan like I am

Hey, I got a Chevy, she can flip a quarter

I'd drive hеr anywhere from herе to California

When this song is over, I gotta find her

'Cause she had me at ""Heads Carolina""



Yeah, she knew every word by heart, didn't need no screen, no

I was raisin' my glass up for her, I saw her smilin' at me, yeah

She had me down in the front by the end of verse two

Like there wasn't no one else in the room, we were singin'



""Heads Carolina, tails California""

Maybe she'd fall for a boy from South Georgia

She's got the bar in the palm of her hand

And she's a '90s country fan like I am

Hey, I got a Chevy, she can flip a quarter

I'd drive her anywhere from here to California

When this song is over, I gotta find her

'Cause she had me at ""Heads Carolina""



Yeah, I bought her a round and we talked 'til the lights came on

I still see that girl every time I hear that song



""Heads Carolina, tails California""

Maybe she'd fall for a boy from South Georgia

She's got the bar in the palm of her hand

And she's a '90s country fan like I am

Hey, I got a Chevy, she can flip a quarter

I'd drive her anywhere from here to California

When this song is over, I gotta find her

'Cause she had me at ""Heads Carolina""



(Heads Carolina, tails California)

Yeah, she had me at ""Heads Carolina"" (Somewhere greener, somewhere warmer)

(Heads Carolina, tails California)

Yeah (Somewhere greener, somewhere warmer)

(Heads Carolina)

(Somewhere together, I've got a quarter)

(Heads Carolina, tails California)"
Vegas,Doja Cat,2022,human,"Yeah, ah, get it
Yeah, ah, get it
Yeah, yeah, ah, get it
Yeah, ah, get it
Yeah, ah, get it
Yeah



(You ain't nothing but a)

Dog, player, ah, get it

Fraud, player, ah, get it

I understand, I understand

You ain't the man, you ain't a man

(You ain't nothing but a)

Hound dog, hound dog, hound dog

(You ain't nothing but a)



Player getting valeted around in that ho whip

Two fingers, set one down on my toes ten

Flewed out, my boobs out, put a cork in it

Love it when you be cryin' out when I'm corseted

I don't think you gon' make it

Do not let me start ragin'

Bitch, I'm losin' my patience

This ain't stayin' in Vegas (You ain't nothing but a)



There's more sides to the story, I'ma tell everybody

Had your ass sittin' courtside with your arm around me

Had your ass sittin' first class with your burnt ass out in Abu Dhabi

Could've been what we should've been but you lost a bet, now you gotta find me

Find a seat, nigga

I ain't playin' this hide and seek

High school when you finally peaked

Hound dog, come find a treat

I'm a bad bitch but (You ain't nothing but a)



Dog, player, ah, get it

Fraud, player, ah, get it

I understand, I understand

You ain't the man, you ain't a man

(You ain't nothing but a)

Hound dog, hound dog, hound dog



Yeah, yeah, I said (You ain't nothing but a)

I get it, I know you got some other shit you wanted

I get it, you needed someone that could prove you wrong

So I reckon, you leave all of your problems at the door to my city

You gon' need to tell my brothers where you from

And I admit it, I still got empathy

And you gon' feel it for two weeks

When I release you in them streets

And keep my meaning discrete

Keep the clean in my Jeep

And put that Yeezy in your teeth

Let my bitches off they leashes

If you even think to speak

I'ma give a whole new meaning

When you said you live in a dream

We can keep that shit asleep

And you gon' laugh with all your Gs

Countin' them sheep, sheep, sheep

Talkin' 'bout Z-Z-Z-Z-Z-Z-Z, R-I-P



(You ain't nothing but a)

Dog, player, ah, get it

Fraud, player, ah, get it

I understand, I understand

You ain't the man, you ain't a man

(You ain't nothing but a)

Hound dog, hound dog, hound dog



(You ain't nothing but a)

Dog, player, ah, get it

Fraud, player, ah, get it

I understand, I understand

You ain't the man, you ain't a man

(You ain't nothing but a)

Hound dog, hound dog, hound dog



You ain't nothing but a

Yeah, ah, get it

Yeah, ah, get it

Yeah, yeah, ah, get it

Yeah, ah, get it

Yeah, yeah, ah, get it

Yeah, you ain't nothing but a"
Buy Dirt,Jordan Davis and Luke Bryan,2022,human,"Few days before he turned 80
He was sitting out back in a rocker
He said, what you been up to lately
I told him chasing a dollar
And in between sips of coffee
He poured this wisdom out

Said if you want my two cents on making a dollar count



Buy dirt

Find the one you can’t live without

Get a ring, let your knee hit the ground

Do what you love but call it work

And throw a little money in the plate at church

Send some prayers up and your roots down deep

Add a few limbs to your family tree

And watch their pencils marks

And the grass in the yard

All grow up

‘Cause the truth about it is

It all goes by real quick

You can’t buy happiness

But you can buy dirt



Before you get caught on that ladder

Let me tell you what it’s all about

Find you a few things that matter

That you can put a fence around

And then he laid it out



Buy dirt

Find the one you can’t live without

Get ring, let your knee hit the ground

Do what you love but call it work

And throw a little money in the plate at church

Send some prayers up and your roots down deep

And add a few limbs to your family tree

And watch their pencils marks

And the grass in the yard

All grow up

‘Cause the truth about it is

It all goes by real quick

You can’t buy happiness

But you can buy dirt



You can buy dirt



And thank the good Lord for it

‘Cause He ain’t makin’ any more of it



Buy dirt

Find the one you can’t live without

Get ring, let your knee hit the ground

Do what you love but call it work

And throw a little money in the plate at church

Send some prayers up and your roots down deep

Add a few limbs to your family tree

Watch their pencils marks

And the grass in the yard

All grow up

‘Cause the truth about it is

It all goes by real quick

You can’t buy happiness

But you can buy dirt"
I Hate U,SZA,2022,human,"I be so sick of you niggas, y'all contradicting
I be so bored with myself, can you come and fuck me?
I feel so ordinary, sad when you around me
Treat me like corduroy, wear me out
Arguments, you air me out
Tripping 'bout your whereabouts

I can't keep no conflict with you, boy, can we just rub it out?

I don't want no static with you, you know you my plug

And I can't shake this habit, no



I've been up, baby

Heavy reminiscin'

Heavy on the missin' you

Wish shit was different than what it was

I've been up, baby

Lost in the lie of us

Lost, ain't no findin' us

I've been up, baby



And if you wondered if I hate you (I do)

Shitty of you to make me feel just like this

What I would do to make you feel just like this

And if you wondered if I hate you (Fuck you)

Shitty of you to make mе feel just like this

What I would do to make you feel just like this



Usеd to be too solid 'til you scrambled me

Used to be your rider, you mishandle me

Used to be nonviolent 'til you ambushed me

Now I'm out here wildin' with you

Now I'm out here, silent treatment, that mean no permission (No)

Missionary gettin' boring, can you switch positions? (Yeah)

Hard to save your soul, you don't ever listen, no (No)



I've been up, baby

Heavy reminiscin'

Heavy on the missin' you

Wish shit was different than what it was

I've been up, baby

Lost in the lie of us

Lost, ain't no findin' us

I've been up, baby



And if you wondered if I hate you (I do)

Shitty of you to make me feel just like this

What I would do to make you feel just like this

And if you wondered if I hate you (Fuck you)

Shitty of you to make me feel just like this

What I would do to make you feel just like this"
Boyfriend,Dove Cameron,2022,human,"I can't believe we're finally alone
I can't believe I almost went home
What are the chances? Everyone's dancing
And he's not with you (Hm, hm, hm, hm)
The universe must have divined us

What am I gonna do?

Not gonna grab your wrist?



I could be a better boyfriend than him

I could do the shit that he never did

Up on that, I won't quit

Thinking about how you could stay away from him

I could be such a gentleman

Plus all my clothes would fit



Oh, oh, oh, oh, oh, oh

Oh, oh, oh, oh, oh, oh

I could be a better boyfriend



I don't need to tell you twice

All the ways he can't sufficе

If I could give you some advice

I would lеave with me tonight



The universe must have divined us

Hm, hm, hm, hm

Ladies first, baby, I insist



I could be a better boyfriend than him

I could do the shit that he never did

Up on that, I won't quit

Thinking I'm gonna steal you from him

I could be such a gentleman

Plus all my clothes would fit



Oh, oh, oh, oh, oh, oh

Oh, oh, oh, oh, oh, oh

I could be a better boyfriend than him

Oh, oh, oh, oh, oh, oh

Oh, oh, oh, oh, oh, oh

I could be a better boyfriend



I never would've left you alone

Here on your own

Go to your phone

Never would've left you alone

For someone else to take you home



I could be a better boyfriend than him

I could do the shit that he never did

Up on that, I won't quit

I'm gonna steal you from him

I could be such a gentleman

Plus you know my clothes would fit

I could be a better boyfriend than him

I could do the shit that he never did

Up on that, I won't quit

Thinking I'm gonna steal you from him

I could be such a gentleman

Plus all my clothes would fit"
Glimpse of Us,Joji,2022,human,"She'd take the world off my shoulders
If it was ever hard to move
She'd turn the rain to a rainbow
When I was living in the blue
Why then, if she's so perfect
Do I still wish that it was you?

Perfect don't mean that it's workin'

So what can I do? (Ooh)



When you're out of sight

In my mind



'Cause sometimes I look in her eyes

And that's where I find a glimpse of us

And I try to fall for her touch

But I'm thinkin' of the way it was

Said I'm fine and said I moved on

I'm only here passing time in her arms

Hopin' I'll find a glimpse of us



Tell me he savors your glory

Does he laugh the way I did?

Is this a part of your story?

One that I had never lived

Maybe one day, you'll feel lonely

And in his eyes, you'll get a glimpse

Maybe you'll start slippin' slowly and find me again



When you're out of sight

In my mind



'Cause sometimes I look in her eyes

And that's where I find a glimpse of us

And I try to fall for her touch

But I'm thinkin' of the way it was

Said I'm fine and said I moved on

I'm only here passing time in her arms

Hopin' I'll find a glimpse of us



Ooh

Ooh-ooh-ooh

Ooh

Ooh-ooh-ooh



'Cause sometimes I look in her eyes

And that's where I find a glimpse of us

And I try to fall for her touch

But I'm thinkin' of the way it was

Said I'm fine and said I moved on

I'm only here passing time in her arms

Hopin' I'll find a glimpse of us"
Surface Pressure,Jessica Darrow,2022,human,"I'm the strong one
I'm not nervous
I'm as tough as the crust of the earth is
I move mountains
I move churches

And I glow 'cause I know what my worth is



I don't ask how hard the work is

Got a rough, indestructible surface

Diamonds and platinum, I find 'em, I flatten 'em

I take what I'm handed, I break what's demanded, but



Under the surface

I feel berserk as a tightrope walking in a three-ring circus

Under the surface

Was Hercules ever like “Yo, I don't wanna fight Cerberus?”



Under the surface

I'm pretty surе I'm worthless is I can't be of servicе

A flaw or a crack

The straw in the stack

That breaks the camel's back

What breaks the camel's back?



It's pressure like a drip, drip, drip, that'll never stop, whoa

Pressure that'll tip, tip, tip till you just go pop, whoa-uh-uh

Give it to your sister, your sister's older

Give her all the heavy things we can't shoulder

Who am I if I can't run with the ball?

If I fall to



Pressure like a grip, grip, grip, and it won't let go, whoa

Pressure like a tick, tick, tick till it's ready to blow, whoa-uh-uh

Give it to your sister, your sister's stronger

See if she can hang on a little longer

Who am I if I can't carry it all?

If I falter"
Fall in Love,Bailey Zimmerman,2022,human,"Heard you moved out to South Carolina
Just like you always said we would
Packed your bags in that old 4Runner
That I bought you when things were good
I'm glad to see the stop sign didn't hit ya
Bring you back to your senses

Oh, it waved you gone, goodbye

Yeah, it waved you gone, goodbye



I heard you found yourself a brand new man

Put a rock on your finger and he vowed you a second chance

Built a house right by the coast

That ocean view is beautiful, but baby, I just want you to know

He don't know you like I did

Money talks, but I ain't buyin'



'Cause love's a smoke ring wrapped around your finger

One second, it's a blessin', and the next, it's already gone

A broken heart, I'm a walkin' testimony

My confession is a lesson that I'm pourin' out in this song

Oh-woah-woah, oh-woah-woah

You don't wanna fall in love

Oh-woah-woah, oh-woah-woah

You don't wanna fall in love



I seen your mama walkin' out the county market

And I thought to ask her how she's been

Said she's missin' ya and tried to go convincin' ya

Not to settle down with him

She ain't wrong, the whole town knows it

You had a bed of roses, but girl, you couldn't walk that line

You can act like you're doin' fine



'Cause love's a smoke ring wrapped around your finger

One second, it's a blessin', and the next, it's already gone

A broken heart, I'm a walkin' testimony

My confession is a lesson that I'm pourin' out in this song

Oh-woah-woah, oh-woah-woah

You don't wanna fall in love

Oh-woah-woah, oh-woah-woah

You don't wanna fall in love





'Cause love's a smoke ring wrapped around your finger

One second, it's a blessin', and the next, it's already gone

A broken heart, I'm a walkin' testimony

My confession is a lesson that I'm pourin' out in this song

Oh-woah-woah, oh-woah-woah

You don't wanna fall in love

Oh-woah-woah, oh-woah-woah

You don't wanna fall in love

Oh-woah-woah, oh-woah-woah

You don't wanna fall in love

Oh-woah-woah, oh-woah-woah



Heard you moved out to South Carolina

Just like you always said we would"
Love Nwantiti (Ah Ah Ah),CKay,2022,human,"Tu-tu-tu, tu-tu-tu-uh-tu-tu
Uh-tu-tu-tu, tu-tu-tu-uh-tu-tu
CKay, yo
My baby my valentine (Uh)
Girl na you dey make my temperature dey rise

If you leave me, I go die (I swear o)

You are like the oxygen I need to survive

I'll be honest

Your loving dey totori me

I-I'm so obsessed

I want to chop your nkwobi



(Unle) Your body dey baka mi si (Unle)

Open am make I see (Unle)

Gimme love nwantiti

Baby make a bad man sing oh yeah



Ah-ah-ah-ah-ah-ah

Ah-ah-ah-ah-ah-ah-ah-ah

Ah-ah-ah-ah-ah-ah

Ah-ah-ah-ah-ah-ah-ah-ah

Ah-ah-ah-ah-ah-ah

Ah-ah-ah-ah-ah-ah-ah-ah

Ah-ah-ah-ah-ah-ah

Ah-ah-ah-ah-ah-ah-ah-ah



Baby girl, where you from come (Eh)

Your body na follow come (Yeah)

No be silicon (Eh)

Baba God e finish work (Eh-eh-eh-eh-eh)

Without you I go fit lose my mind

Without you I go fit fall and die

Without you I go give all my life

Without you (without you)



(Unle) Your body dey baka mi si (Unle)

Open am make I see (Oh yeah)

Gimme love nwantiti

Baby make a bad man sing oh yeah



Ah-ah-ah-ah-ah-ah

Ah-ah-ah-ah-ah-ah-ah-ah

Ah-ah-ah-ah-ah-ah

Ah-ah-ah-ah-ah-ah-ah-ah

Ah-ah-ah-ah-ah-ah

Ah-ah-ah-ah-ah-ah-ah-ah

Ah-ah-ah-ah-ah-ah

Ah-ah-ah-ah-ah-ah-ah-ah



You mean the world to me

If I live in fantasy

Ah ya eiya

I love you

Ah ya eiya

No one above you

Lover, don't give this love to nobody

Lover, don't call another nigga honey

Lover, lover

I wanna be your lover

Forever, forever



Tu-tu-tu, tu-tu-tu-uh-tu-tu

Uh-tu-tu-tu, tu-tu-tu-uh-tu-tu

(Tempo) CKay, yo"
Super Freaky Girl,Nicki Minaj,2022,human,"She's alright
That girl's alright with me
Yeah
Ay, yo

I can lick it, I can ride it

While you slippin' and slidin'

I can do all them little tricks and keep the dick up inside it

You can smack it, you can grip it

You can go down and kiss it

And every time he leave me 'lone, he always tell me he miss it

He want a F-R-EEEEE-A-K

F-R-EEEEE-A-K, A-K, A-K, A-K

EEEEE-A-K

F-R-EEEEE-A-K



One thing about me, I'm the baddest alive

He know the prettiest bitch didn't come until I arrive

I don't let bitches get to me, I fuck they man if they try

I got a princess face, a killer body, samurai mind

They can't be Nicki, they so stupid, I just laugh when they try

A thong bikini up my ass, I think I'll go for a dive

His ex bitch went up against me, but she didn't survive

On applications I write, ""Pressure"", 'cause that's what I apply (Brrrr)

Pressure applied, can't fuck a regular guy

Wetter than umbrellas and stickier than Apple Pie



I can lick it, I can ride it

While you slippin' and slidin'

I can do all them little tricks and keep the dick up inside it

You can smack it, you can grip it

You can go down and kiss it

And every time he leave me 'lone, he always tell me he miss it

He want a F-R-EEEEE-A-K

F-R-EEEEE-A-K, A-K, A-K, A-K

EEEEE-A-K

F-R-EEEEE-A-K



'Cause what the fuck, this ain't Chanel, nigga, custom down?

Like, what the fuck, this ain't Burberry, custom brown?

He said, ""Could you throw it back while you touch the ground?""

Then he said, ""Do that pussy purr?"" I said, ""Yup, meow""

Hold up, fuck boys, ain't no need for you to roll up

Ain't no need for you to double tap neither, scroll up

Keep these bitches on they toes like Manolo

Be on the lookout when I come through, BOLO

Oh, whoa

Elegant bitch with a hoe glow

If it ain't big, then I won't blow

Eeny, meeny, miny, moe

Fuck is the tea? I just F'd a G

Make him say ""Uhh"", just ask Master P

Ball so hard, I just took a knee

Get me Rocky A$AP, nigga, word to RIH



Freak

F-f-freak

Some gyal a freak

Gyal a freak

Gyal a freak, freak, freak, freak



I can lick it, I can ride it

While you slippin' and slidin'

I can do all them little tricks and keep the dick up inside it

You can smack it, you can grip it

You can go down and kiss it

And every time he leave me 'lone, he always tell me he miss it

He want a F-R-EEEEE-A-K

F-R-EEEEE-A-K, A-K, A-K, A-K

EEEEE-A-K

F-R-EEEEE-A-K"
Hrs and Hrs,Muni Long,2022,human,"Yours, mine, ours
I could do this for hours
Sit and talk to you for hours
I wanna give you your flowers
And some champagne showers
Order shrimp and lobster towers

But it's me that gets devoured

Ooh



When you do what you do, I'm empowered

You give me a super power

Together the world could be ours

You sit me up on the counter

Instantly, it's thundershowers

Storming for a couple hours

When we finish, take a shower



I could do this for hours

And hours, and hours

I could do this for hours

And hours, and hours

I could do this for hours

And hours, and hours

I could do this for hours

And hours, and hours



I, usually don't like nobody

And when I say nobody I mean nobody

All these niggas full of shit

You just the homie once they hit

Felt like giving up on love

These niggas almost made me quit



Then I met you

When I met you I knew this was it

I've never been in love like this

A love like ours, I prayed for it on my knees

Every night for some hours and hours

And hours and hours and hours, and hours

I could do this for hours and hours and hours

I could do this for hours and hours and hours

What's yours is mine and ours

And yours mine and ours



I can sit and talk to you for hours

Sit and look at you for hours

Making love to you for hours

Laying on your chest for hours

Telling you jokes for hours

Holding you close for hours and hours and hours"
