title,artist,year,source,lyrics
"Going, Going, Gone",Luke Combs,2023,human,"Some things in life are meant to fly
And others, they were born to run
You can't tie down up and leaving
Like the changing of the seasons
Good things, they come and then they go

Like a runaway southbound train

Like an Arizona desert rain

Like lightning in the sky

Like fireworks in July

Like a left field home run ball

Like a whiskey shot at last call

It's like she was made for moving on

That girl is going, going, gone



I can say it wasn't meant to be

Or maybe meant to be's misunderstood

Can't hold on to letting go

Or change the way the river flows

Loving her's like roping in the wind



Like a runaway southbound train

Like an Arizona desert rain

Like lightning in the sky

Like fireworks in July

Like a left field home run ball

Like a whiskey shot at last call

It's like she was made for moving on

That girl is going, going, gone



She ain't got one bit of stick around

There's no sense in trying to slow her down



Like a runaway southbound train

Like an Arizona desert rain

Like lightning in the sky

Like fireworks in July

Like a left field home run ball

Like a whiskey shot at last call

It's like she was made for moving on

That girl is going, going, gone



Going, going, gone

Going, going, gone"
Rockin' Around the Christmas Tree,Brenda Lee,2023,human,"Rockin' around the Christmas tree, at the Christmas party hop
Mistletoe hung where you can see, every couple tries to stop
Rockin' around the Christmas tree, let the Christmas spirit ring
Later we'll have some pumpkin pie and we'll do some caroling

You will get a sentimental feelin' when you hear

Voices singin' let's be jolly

Deck the halls with boughs of holly



Rockin' around the Christmas tree, have a happy holiday

Everyone dancing merrily in the new, old-fashioned way



You will get a sentimental feelin' when you hear

Voices singin' let's be jolly

Deck the halls with boughs of holly



Rockin' around the Christmas tree, have a happy holiday

Everyone dancing merrily in the new, old-fashioned way"
Dancin' in the Country,Tyler Hubbard,2023,human,"Them neon lights
Look good on you, so good on you
But we ain't got
No room to move, no room to move
We need some space and I know a place
Outside of town where it don't ever close down

No, we never close down



Yeah, we can two-step

Put your boots on, baby, we can do that

Girl, cut a little loose, you can move that

Move that, aw, yeah



I'll take you dancin' in the country, Levi's in them low beams

Spin you in some red dirt, sweep you off of both feet

Out here where the sun sets, Silverado backbeat

You'll never wanna go home and never wanna not be

Dancin' in the country

Dancin' in the country



Yeah, it goes left, right, left

You makin' me wanna sway

You makin' me wanna play

Some Alabama and Jackson

Got you 'round my neck

You makin' me wanna stay

You makin' me wanna lay

You down here in the pasture



Yeah, we can two-step

Put your boots on, baby, we can do that

Girl, cut a little loose, you can move that

Move that, aw, yeah



I'll take you dancin' in the country, Levi's in them low beams

Spin you in some red dirt, sweep you off of both feet

Out here where the sun sets, Silverado backbeat

You'll never wanna go home and never wanna not be

Dancin' in the country

Dancin' in the country

Aw, yeah



I know you feel that heat

Watermelon summer

Get them Luccheses

Stompin' like the thunder, yeah



We can two-step

Put your boots on, baby, we can do that

Girl, cut a little loose, you can move that (Woo)

Move that, aw, yeah



I'll take you dancin' in the country, Levi's in them low beams

Spin you in some red dirt, sweep you off of both feet (Oh, yeah)

Out here where the sun sets, Silverado backbeat

You'll never wanna go home and never wanna not be

Dancin' in the country (Don't stop, don't stop, keep it movin')

Dancin' in the country (Don't stop, don't stop, keep it movin')

Dancin' in the country (Don't stop, don't stop, keep it movin')

Oh, yeah

Dancin' in the country (Don't stop, don't stop, keep it movin')

Oh, dancin' in the country (Let's go)"
Daylight,David Kushner,2023,human,"Telling myself ""I won't go there""
Oh but I know that I won't care
Tryna wash away all the blood I've spilt
This lust is a burden that we both share
Two sinners can't atone from a lone prayer
Souls tied, intertwined by our pride and guilt



(Ooh)

There's darkness in the distance

From the way that I've been livin'

But I know I can't resist it



Oh, I love it and I hate it at the same time

You and I drink the poison from the same vine

Oh, I love it and I hate it at the same time

Hidin' all of our sins from the daylight

From the daylight, runnin' from the daylight

From the daylight, runnin' from the daylight

Oh, I love it and I hate it at the same time



Tellin' myself it's the last time

Can you spare any mercy that you might find

If I'm down on my knees again

Deep down, way down, Lord, I try

Try to follow your light, but it's night time

Please, don't leave me in the end



(Ooh)

There's darkness in the distance

I'm beggin' for forgiveness (Ooh)

But I know I might resist it, oh



Oh, I love it and I hate it at the same time

You and I drink the poison from the same vine

Oh, I love it and I hate it at the same time

Hidin' all of our sins from the daylight

From the daylight, runnin' from the daylight

From the daylight, runnin' from the daylight

Oh, I love it and I hate it at the same time



Oh, I love it and I hate it at the same time

You and I drink the poison from the same vine

Oh, I love it and I hate it at the same time

Hidin' all of our sins from the daylight

From the daylight, runnin' from the daylight

From the daylight, runnin' from the daylight

Oh, I love it and I hate it at the same time"
Lift Me Up,Rihanna,2023,human,"Lift me up
Hold me down
Keep me close
Safe and sound
Burning in a hopeless dream

Hold me when you go to sleep

Keep me in the warmth of your love

When you depart, keep me safe

Safe and sound



Lift me up

Hold me down

Keep me close

Safe and sound



Drowning in an endless sea

Take some time and stay with me

Keep me in the strength of your arms

Keep me safe

Safe and sound



Lift me up

Hold me down

Keep me safe

Safe and sound



Burning in a hopeless dream

Hold me when you go to sleep

Keep me safe

We need light, we need love



(Lift me up) Lift me up in your arms

(Hold me down) I need love, I need love, I need love

(Keep me close) Hold me, hold me

(Safe and sound) Hold me, hold me, hold me, hold me

(Lift me up) Hold me, hold me, hold me, hold me

(Hold me down) Hold me, hold me

(Keep me safe) We need light, we need love"
Eyes Closed,Ed Sheeran,2023,human,"I know it's a bad idea
But how can I help myself?
Been inside for most this year
And I thought a few drinks, they might help
It's been a while my dear
Dealing with the cards life dealt

I'm still holding back these tears

While my friends are somewhere else



I pictured this year a little bit different when it hit February

I step in the bar, it hit me so hard

Oh how can it be this heavy?

Every song reminds me you're gone

And I feel thе lump form in my throat

'Cause I'm here alonе



Just dancing with my eyes closed

'Cause everywhere I look I still see you

Time is moving so slow

And I don't know what else that I can do

So I'll keep dancing with my



Eye-ye-eye-eyes

Eye-ye-eye-eyes closed

Eye-ye-eye-eyes

Oh, I keep dancin' with my



Delusion is here again

And I think you'll come home soon

A word brings me right back in

Then it's only me that’s in this room

I guess I could just pretend

The colours are more than blue

But I lost more than my friend

I can't help but missing you



I pictured this month a little bit different no one is ever ready

And when it unfolds you get in a hole

Oh how can it be this heavy?

Everything changes, nothing’s the same

Except the truth is now you’re gone

And life just goes on



So I'm dancin' with my eyes closed

'Cause everywhere I look, I still see you

Time is movin' so slow

And I don't know what else that I can do

So I'll keep dancin' with my



Eye-ye-eye-eyes

Eye-ye-eye-eyes closed

Eye-ye-eye-eyes

Oh, I'll keep dancin' with my

Eye-ye-eye-eyes

Eye-ye-eye-eyes closed

Eye-ye-eye-eyes

Oh, I'll keep dancin' with my



They're shutting the bar, they're cleaning the floors

And everyone is already home

But I'm on my own



Just dancin' with my eyes closed

'Cause everywhere I look, I still see you

Time is movin' so slow

And I don't know what else that I can do

So I keep dancin' with my



Eye-ye-eye-eyes

Eye-ye-eye-eyes closed

Eye-ye-eye-eyes

Oh, I keep dancin' with my

Eye-ye-eye-eyes

Eye-ye-eye-eyes closed

Eye-ye-eye-eyes

Oh, I keep dancin' with my"
TQG,Karol G and Shakira,2023,human,"La que te dijo que un vacío se llena con otra persona, te miente
Es como tapar una herida con maquillaje, no se ve, pero se siente
Te fuiste diciendo que me superaste y te conseguiste nueva novia
Lo que ella no sabe es que tú todavía me estás viendo toda' las historias
Bebé, ¿qué fue?

¿No pues que muy tragadito?

¿Qué haces buscándome el lado?

Si sabes que yo errores no repito

Dile a tu nueva bebé

Que por hombres no compito

Que deje de estar tirando

Que al menos yo te tenía bonito



Verte con la nueva me dolió

Pero ya estoy puesta pa' lo mío

Lo que vivimos se me olvidó

Y eso es lo que te tiene ofendido



Que hasta la vida me mejoró

Por acá ya no eres bienvenido

Vi lo que tu novia me tiró

Eso no da ni rabia, yo me río, yo me río



No tengo tiempo pa' lo que no aporte, ya cambié mi Norte

Haciendo dinero como deporte

Llenando la cuenta, los shows, el parking y el pasaporte

Estoy más dura, dicen los reportes



Ahora tú quieres volver, se te nota, mmm, sí

Espérame ahí, que yo soy idiota

Se te olvidó que estoy en otra

Y que te quedó grande la Bichota



Bebé, ¿qué fue?

¿No pues que muy tragadito?

¿Qué haces buscándome el lado?

Si sabes que yo errores no repito

Dile a tu nueva bebé

Que por hombres no compito

Que deje de estar tirando

Que al menos yo te tenía bonito



Shakira, Shakira



Tú te fuiste y yo me puse triple M

Más buena, más dura, más level

Volver contigo never

Tú eras la mala suerte porque ahora las bendiciones me llueven



Y quieres volver, ya lo suponía

Dándole like a las foto' mía'

Tú buscando por fuera la comida

Yo diciendo que era monotonía



Y ahora quieres volver, ya lo suponía

Dándole like a las foto' mía'

Te ves feliz con tu nueva vida, pero

Si ella supiera que me buscas todavía



Bebé, ¿qué fue?

¿No pues que muy tragadito?

¿Qué haces buscándome el lado?

Si sabes que yo errores no repito

Dile a tu nueva bebé

Que por hombres no compito

Que no tiene buena mano

Y al menos yo te tenía bonito



O-O-Ovy On the Drums

Mi amor, es que usted se alejó mucho

Y yo de lejos no veo, bebé

TQM

Pero TQG

Barranquilla, Medallo"
Try That in a Small Town,Jason Aldean,2023,human,"Sucker punch somebody on a sidewalk
Car jack an old lady at a red light
Pull a gun on the owner of a liquor store
Ya think it's cool, well, act a fool if ya like
Cuss out a cop, spit in his face
Stomp on the flag and light it up

Yeah, ya think you're tough



Well, try that in a small town

See how far ya make it down the road

'Round here we take care of our own

You cross that line, it won't take long

For you to find out, I recommend you don't

Try that in a small town



Got a gun that my granddad gave me

They say one day they're gonna round up

Well, that shit might fly in the city, good luck



Well, try that in a small town

See how far ya make it down the road

'Round here we take care of our own

You cross that line, it won't take long

For you to find out, I recommend you don't



Try that in a small town

Full of good ol' boys, raised up right

If you're looking for a fight

Try that in a small town

Try that in a small town



Try that in a small town

(See how far ya make it down the road)

'Round here we take care of our own

You cross that line, it won't take long

For you to find out, I recommend you don't

Try that in a small town

Try that in a small town, mm-mm



Try that in a small town"
Tennessee Orange,Megan Moroney,2023,human,"Mama, I'm callin', I've got some news
Don't you tell daddy, he'll blow a fuse
Don't worry, I'm doin' okay
I know you raised me to know right from wrong
It ain't what you think and I'm still writin' songs
Just never thought I'd see the day

I've never felt this way

I met somebody and he's got blue eyes

He opens the door and he don't make me cry

He ain't from where we're from, but he feels like home, yeah

He's got me doin' things I've never done

In Georgia, they call it a sin

I'm wearin' Tennessee orange for him

Took me to Knoxville last Saturday

And I wore the hat on his dash to the game

Sure wasn't Athens but I

Fell for him under those Neyland lights

I met somebody and he's got blue eyes

He opens the door and he don't make me cry

He ain't from where we're from, but he feels like home, yeah

He's got me doin' things I've never done

In Georgia, they call it a sin

I'm wearin' Tennessee orange for him

Mama, forgive me, I like him a lot

Hell, I'm learnin' the words to old Rocky Top

And he's got a smile that makes me forget

I've always looked better in red

But I met somebody and he's got blue eyes

He opens the door and he don't make me cry

He ain't from where we're from, but he feels like home, yeah

He's got me doin' things I've never done

I met somebody and he's got blue eyes

He opens the door and he don't make me cry

He ain't from where we're from, but he feels like home, yeah

He's got me doin' things I've never done

In Georgia they call it a sin

And I'll steal all the dogs to him

But I'm wearin' Tennessee orange for him

I'm wearin' Tennessee orange for him"
Jingle Bell Rock,Bobby Helms,2023,human,"Jingle bells, jingle bells, jingle bells rock
Jingle bells swing and jingle bells ring
Snowin' and blowin' up bushels of fun
Now the jingle hop has begun
Jingle bells, jingle bells, jingle bells rock

Jingle bells chime in jingle bell time

Dancin' and prancin' in Jingle Bell Square

In the frosty air



What a bright time, it's the right time

To rock the night away

Jingle bell time is a swell time

To go glidin' in a one-horse sleigh



Giddy-up jingle horse, pick up your feet

Jingle around the clock

Mix and a-mingle in the jinglin' feet

That's the jingle bell rock



Jingle bells, jingle bells, jingle bells rock 

Jingle bells chime in jingle bell time

Dancin' and prancin' in Jingle Bell Square

In the frosty air



What a bright time, it's the right time

To rock the night away

Jingle bell time is a swell time

To go glidin' in a one-horse sleigh



Giddy-up jingle horse, pick up your feet

Jingle around the clock

Mix and a-mingle in the jinglin' feet

That's the jingle bell

That's the jingle bell

That's the jingle bell rock"
Princess Diana,Ice Spice and Nicki Minaj,2023,human,"Grrah, grrah
(Stop playin' with 'em, RIOT)
Like, grrah, keep it a stack
Bitches move wock' 'cause they know I got bands (Damn)
They be chattin', I don't give a damn and I'm still gettin' money, I know who I am (Grrah)

Tryna be low, he gon' hit up my 'Gram (Grrah)

If he smart, he gon' act like a fan (Damn)

Thinkin' you bigger, they got ya head gassed (Grrah)

Bitches slow, so I give 'em a pass

Like, grrah, keep it a stack

Bitches move wock' 'cause they know I got bands (Damn)

They be chattin', I don't give a damn and I'm still gettin' money, I know who I am (Grrah)

Tryna be low, he gon' hit up my 'Gram (Grrah)

If he smart, he gon' act like a fan (Damn)

Thinkin' you bigger, they got ya head gassed (Grrah)

Bitches slow, so I give 'em a pass



And I just fell in love with a gangsta (Like)

So he put my name in a tat' (Damn)

But I don't let him come to the crib (Grrah)

So we get it on where we at (Grrah)

Nowadays, I be duckin' them cameras

And they hype that I'm up on them banners

Callin' my phone, but they know I don't answer (Why?)

In the hood I'm like Princess Diana (Grrah)

I'm thick 'cause I be eatin' oats (Huh)

Bitches not takin' shit from me but notes

Wanna be me, so she do my emotes

And my name in her mouth so I bet she gon' choke (Bitch)

To her man, I'm the girl of his dreams

Thinkin' 'bout me when he brushin' his teeth

He keep textin', I leave him on seen

Hottest bitch out and they know what I mean (Know what I mean)



Like, grrah, keep it a stack

Bitches move wock' 'cause they know I got bands (Damn)

They be chattin', I don't give a damn and I'm still gettin' money, I know who I am (Grrah)

Tryna be low, he gon' hit up my 'Gram (Grrah)

If he smart, he gon' act like a fan (Damn)

Thinkin' you bigger, they got ya head gassed (Grrah)

Bitches slow, so I give 'em a pass

Like, grrah, keep it a stack

Bitches move wock' 'cause they know I got bands (Damn)

They be chattin', I don't give a damn and I'm still gettin' money, I know who I am (Grrah)

Tryna be low, he gon' hit up my 'Gram (Grrah)

If he smart, he gon' act like a fan (Damn)

Thinkin' you bigger, they got ya head gassed (Grrah)

Bitches slow, so I give 'em a pass



Lookin' at me like who bigger than she? (Who?)

I'm the one who they wishin' to be (Damn)

Takin' my time, 'cause I don't wanna bait

If you makin' your plate, then I already ate (Grrah)

I book a flight and go chill in Tulum

Turnin' heads when I walk in the room (Like)

I know he want me, his bitch is a lame and she make in a year what I spend on a chain (Spend on my chain, grrah)

Makin' it rain (Makin' it rain)

Doin' my thing (Like)

And I'm young, still gettin' money, my pockets is chubby, nothin' was the same (Huh)

Takin' ya boo (Takin' ya boo), makin' it move

Like flexin' on niggas and bitches addictin', feenin' for me how they usually do (Usually do)



Like, grrah, keep it a stack

Bitches move wock' 'cause they know I got bands (Damn)

They be chattin', I don't give a damn and I'm still gettin' money, I know who I am (Grrah)

Tryna be low, he gon' hit up my 'Gram (Grrah)

If he smart, he gon' act like a fan (Damn)

Thinkin' you bigger, they got ya head gassed (Grrah)

Bitches slow, so I give 'em a pass

Like, grrah, keep it a stack

Bitches move wock' 'cause they know I got bands (Damn)

They be chattin', I don't give a damn and I'm still gettin' money, I know who I am (Grrah)

Tryna be low, he gon' hit up my 'Gram (Grrah)

If he smart, he gon' act like a fan (Damn)

Thinkin' you bigger, they got ya head gassed (Grrah)

Bitches slow, so I give 'em a pass"
A Holly Jolly Christmas,Burl Ives,2023,human,"Have a holly, jolly Christmas
It's the best time of the year 
I don't know if there'll be snow
But have a cup of cheer

Have a holly, jolly Christmas

And when you walk down the street 

Say hello to friends you know 

And everyone you meet



Oh

Ho

The mistletoe 

Hung where you can see



Somebody waits for you

Kiss her once for me

Have a holly jolly Christmas

And in case you didn't hear



Oh by golly

Have a holly

Jolly Christmas this year



Have a holly, jolly Christmas

It's the best time of the year 



Have a holly, jolly Christmas

And when you walk down the street 

Say hello to friends you know 

And everyone you meet



Oh

Ho

The mistletoe 

Hung where you can see



Somebody waits for you

Kiss her once for me

Have a holly jolly Christmas

And in case you didn't hear



Oh by golly

Have a holly

Jolly Christmas this year"
Where She Goes,Bad Bunny,2023,human,"Baby, dime la verdad
Si te olvidaste de mí
Yo sé que fue una noche na' má'
Que no se vuelve a repetir
Tal ve' en ti quise encontrar
Lo que en otra perdí

Tu orgullo no me quiere hablar

Entonce' vamo' a competir, a ver, ey



No me gusta perder (Ey), dime qué vamo' a hacer

Me paso mirando el cel (Ah), wow, no puede ser (No, no)

Aunque me tarde un poco, juro que vo'a responder

Quisiera volverte a ver

Quisiera volverte a ver encima de mí brincando, uh, uh, uh

Lo rica que te ves chingando, uh, uh, uh (Ey, ey)

No sé qué estamo' esperando (Dime)

El orgullo nos está ganando, ey



Baby, dime la verdad

Si te olvidaste de mí

Yo sé que fue una noche na' má'

Que no se vuelve a repetir

Tal ve' en ti quise encontrar, ey

Lo que en otra perdí

Tu orgullo no me quiere hablar

Entonce' vamo' a competir, a ver, ey



Uh, desde que nos vimo' pienso en cómo nos comimo', ey

Después dividimo', cada cual por su camino

En la alfombra aún están las mancha' de vino

¿Dónde está ese totito? Que lleva tiempo perdido

Si te digo que me gusta', que estás buena, no lo tome' por cumplido

Es que yo soy un bellaco, es que yo soy un atrevido, ey

Y hace tiempo que quiero chingar contigo

Mami, te vo'a dar hasta que te duela la popola como a Glou (Glou)

Me gusta tu flow (Flow)

Tranquilita tú siempre te roba' el show (Ey)

Una perversa, le vo'a dar dembow (Mami)

Si se pone en cuatro, I go where she goes (Ey, ey, ey)

So, mami, dime a ver (Ey, ey)

I wanna feel that pussy again (Ey, ey)

Tú tiene' piquete y yo también (Yo también)

Por poco pierdo y te envío un DM, ey



Pa' decirte la verdad

Que no me he olvida'o de ti

Yo sé que fue una noche na' má'

Que no se vuelve a repetir

Tal vez en ti quise encontrar

Lo que en otra perdí

Tu orgullo no me quiere hablar

Entonce' vamo' a competir, a ver, ey"
Bebe Dame,Fuerza Regida and Grupo Frontera,2023,human,"Tengo tiempo pensando en los dos
Si podemos arreglar la situación
Lo nuestro es una guerra en el amor
Defiendo lo que me pide el corazón
Quiero comerte yo todos los días

Me enamorabas con lo que me decías

Tenerte de nuevo es mi fantasía



Bebe, lo que pido, ven, dame

Lo que te exijo no quisiera

Que pase otro día y no te vea al amanecer

Bebe, lo que pido, ven, dame

Lo que te exijo no quisiera

Que pase Otro día y no te vea al amanecer



Tengo mil planes

Propuestas para amar

Tú y yo en la soledad



Te escribí un poema

Para enamorarte

Solo quiero amarte



Yo aquí te espero solo vente, vente, vente

Yo lo hago diferente

Yo aquí te espero solo vente, vente, vente

No sales de mi mente

Yo aquí te espero solo vente, vente, vente

Yo sé como quererte

Dime que sí, dime que si

Voy a tenerte



Quiero comerte yo todos los días

Me enamorabas con lo que me decías

Tenerte de nuevo es mi fantasía



Bebe, lo que pido, ven, dame

Lo que te exijo no quisiera

Que pase Otro día y no te vea al amanecer

Bebe, lo que pido, ven, dame

Lo que te exijo no quisiera

Que pase Otro día y no te vea al amanecer



Tengo mil planes

Propuestas para amar

Tú y yo en la soledad



Te escribí un poema

Para enamorarte

Solo quiero amarte



Yo aquí te espero solo vente, vente, vente

Yo lo hago diferente

Yo aquí te espero solo vente, vente, vente

No sales de mi mente

Yo aquí te espero solo vente, vente, vente

Yo sé como quererte

Dime que sí, dime que si

Voy a tenerte"
I Remember Everything,Zach Bryan featuring Kacey Musgraves,2023,human,"Rotgut whiskey's gonna ease my mind
Beach town rests on the drying line
Do I remind you of your daddy in his '88 Ford?
Labrador hanging out the passenger door
The sand from your hair is blowing in my eyes

Blame it on the beach, grown men don't cry



Do you remember that beat-down basement couch?

I'd sing you my love songs, and you'd tell me about

How your momma ran off and pawned her ring

I remember, I remember everything



A cold shoulder at closing time, you were begging me to stay 'til the sun rose

Strange words come on out of a grown man's mouth when his mind's broke

Pictures and passing time, you only smile like that when you're drinking

I wish I didn't, but I do remember every moment on the nights with you



You're drinking everything to ease your mind

But when the hell are you gonna ease mine?

You're like concrete feet in the summer heat

That burns like hell when two souls meet

No, you'll never be the man that you always swore

But I'll remember you singing in that '88 Ford



A cold shoulder at closing time, you were begging me to stay 'til the sun rose

Strange words come on out of a grown man's mouth when his mind's broke

Pictures and passing time, you only smile like that when you're drinking

I wish I didn't, but I do remember every moment on the nights with you



A cold shoulder at closing time, you were begging me to stay 'til the sun rose

Strange words come on out of a grown man's mouth when his mind's broke

Pictures and passing time, you only smile like that when you're drinking

I wish I didn't, but I do remember every moment on the nights with you



Rotgut whiskey's gonna ease my mind

Beach town rests on the drying line

Do I remind you of your daddy in my '88 Ford?

Labrador hanging out the passenger door"
